{
  "version": "1.0.0",
  "generated_at": "2026-03-21T10:00:00Z",
  "source": {
    "url": "https://example.com",
    "tool": "axag-cli",
    "tool_version": "1.0.0",
    "paths": ["src/", "public/"]
  },
  "conformance": "full",
  "actions": [
    {
      "intent": "product.search",
      "entity": "product",
      "action_type": "read",
      "operation_id": "product_search",
      "description": "Search the product catalogue",
      "required_parameters": [
        {
          "name": "query",
          "type": "string",
          "description": "Search query text"
        }
      ],
      "optional_parameters": [
        {
          "name": "category",
          "type": "string",
          "description": "Category filter",
          "enum": ["electronics", "clothing", "books", "home"]
        },
        {
          "name": "page",
          "type": "number",
          "description": "Page number",
          "min": 1,
          "default": 1
        },
        {
          "name": "limit",
          "type": "number",
          "description": "Results per page",
          "min": 1,
          "max": 100,
          "default": 20
        }
      ],
      "risk_level": "none",
      "idempotent": true,
      "scope": "global",
      "element_selector": "button#search-btn",
      "source_file": "src/components/SearchBar.tsx",
      "source_line": 12
    },
    {
      "intent": "cart.add_item",
      "entity": "cart",
      "action_type": "write",
      "operation_id": "cart_add_item",
      "description": "Add an item to the shopping cart",
      "required_parameters": [
        {
          "name": "product_id",
          "type": "string",
          "description": "Product identifier",
          "format": "uuid"
        },
        {
          "name": "quantity",
          "type": "number",
          "description": "Number of items to add",
          "min": 1,
          "max": 99
        }
      ],
      "risk_level": "low",
      "idempotent": false,
      "scope": "user",
      "side_effects": ["inventory_reserved"],
      "source_file": "src/components/AddToCart.tsx",
      "source_line": 8
    },
    {
      "intent": "order.place",
      "entity": "order",
      "action_type": "write",
      "operation_id": "order_place",
      "description": "Place a new order from the current cart",
      "required_parameters": [
        {
          "name": "cart_id",
          "type": "string",
          "description": "Cart identifier",
          "format": "uuid"
        },
        {
          "name": "shipping_address_id",
          "type": "string",
          "description": "Shipping address identifier"
        }
      ],
      "optional_parameters": [
        {
          "name": "notes",
          "type": "string",
          "description": "Order notes",
          "maxLength": 500
        }
      ],
      "risk_level": "high",
      "confirmation_required": true,
      "idempotent": false,
      "scope": "user",
      "side_effects": ["email_sent", "inventory_deducted", "payment_charged"],
      "preconditions": ["cart is not empty", "shipping address is valid", "payment method is set"],
      "postconditions": ["order created", "cart cleared", "confirmation email sent"],
      "source_file": "src/components/Checkout.tsx",
      "source_line": 22
    },
    {
      "intent": "account.delete",
      "entity": "account",
      "action_type": "delete",
      "operation_id": "account_delete",
      "description": "Permanently delete the user account and all associated data",
      "required_parameters": [
        {
          "name": "account_id",
          "type": "string",
          "description": "Account identifier",
          "format": "uuid"
        },
        {
          "name": "confirmation_text",
          "type": "string",
          "description": "User must type 'DELETE' to confirm"
        }
      ],
      "risk_level": "critical",
      "confirmation_required": true,
      "approval_required": true,
      "approval_roles": ["admin", "account_owner"],
      "idempotent": true,
      "scope": "user",
      "side_effects": ["data_deletion_started", "email_sent", "subscriptions_cancelled"],
      "preconditions": ["no active subscriptions", "no pending orders"],
      "postconditions": ["account deactivated", "data retention period started"],
      "source_file": "src/pages/Settings.tsx",
      "source_line": 45
    },
    {
      "intent": "user.list",
      "entity": "user",
      "action_type": "read",
      "operation_id": "user_list",
      "description": "List all users in the current tenant",
      "optional_parameters": [
        {
          "name": "search",
          "type": "string",
          "description": "Search by name or email"
        },
        {
          "name": "role",
          "type": "string",
          "description": "Filter by role",
          "enum": ["admin", "member", "viewer"]
        },
        {
          "name": "page",
          "type": "number",
          "description": "Page number",
          "min": 1,
          "default": 1
        }
      ],
      "risk_level": "none",
      "idempotent": true,
      "scope": "tenant",
      "source_file": "src/pages/Admin.tsx",
      "source_line": 15
    }
  ]
}
